{
  "schemaVersion": 1,
  "payloadEncoding": "base64-json-utf8",
  "payloadBase64": "ewogICJzY2hlbWFWZXJzaW9uIjogMSwKICAia2luZCI6ICJzY3JvbGxjYXNlLmJveC5yZWxlYXNlIiwKICAiYm94SWQiOiAiZXhhbXBsZS1tb2RlbCIsCiAgIm1vZGVsSWQiOiAiZXhhbXBsZS1vcmctZXhhbXBsZS1tb2RlbCIsCiAgInJ1bnRpbWVJZCI6ICJleGFtcGxlLW1vZGVsLXJ1bnRpbWUiLAogICJ2ZXJzaW9uIjogIjEuMC4wIiwKICAidGFyZ2V0IjogewogICAgInBsYXRmb3JtIjogIm1hY29zIiwKICAgICJhcmNoIjogImFhcmNoNjQiLAogICAgImFjY2VsZXJhdG9yIjogIm1ldGFsIgogIH0sCiAgImNvbXBhdGliaWxpdHkiOiB7CiAgICAibWluSG9zdEFwcFZlcnNpb24iOiAiMS4wLjAiLAogICAgIm1pbk1hY29zVmVyc2lvbiI6ICIxMy4wIiwKICAgICJtaW5SYW1HYiI6IDgKICB9LAogICJhcmNoaXZlIjogewogICAgImZvcm1hdCI6ICJ6aXAiLAogICAgInVybCI6ICJodHRwczovL2Fzc2V0cy5leGFtcGxlLm9yZy9ib3hlcy9ib3hlcy9leGFtcGxlLW1vZGVsLzEuMC4wL21hY29zLWFhcmNoNjQtbWV0YWwvN2QyYzlhNDFlOGIzNTBmNmMxNzRhOWRlMjAzNThiZjQxYzZlOTdkMDVhOGIzZjI2MTllNGM3MDgxZGE1YjNmMi56aXAiLAogICAgInNoYTI1NiI6ICI3ZDJjOWE0MWU4YjM1MGY2YzE3NGE5ZGUyMDM1OGJmNDFjNmU5N2QwNWE4YjNmMjYxOWU0YzcwODFkYTViM2YyIiwKICAgICJzaXplQnl0ZXMiOiA2NTU3NTIyMTYKICB9LAogICJpbnN0YWxsZWRTaXplQnl0ZXMiOiAxODkyMzQwMTEyLAogICJweXRob25FbnRyeVBvaW50IjogInZlbnYvYmluL3B5dGhvbiIsCiAgIm1vZGVsQ2FjaGVTdWJkaXIiOiAibW9kZWwtY2FjaGUvZXhhbXBsZS1tb2RlbCIsCiAgInNlbGZUZXN0IjogewogICAgInB5dGhvbkltcG9ydHMiOiBbCiAgICAgICJ0b3JjaCIsCiAgICAgICJudW1weSIKICAgIF0sCiAgICAidGltZW91dFNlY29uZHMiOiAxODAKICB9LAogICJwcm92ZW5hbmNlIjogewogICAgInJlY2lwZUlkIjogImV4YW1wbGUtbW9kZWwtbWFjb3MtYXJtNjQtbWV0YWwiLAogICAgInJlY2lwZVZlcnNpb24iOiAiMS4wLjAiLAogICAgImJ1aWxkZXJSZXZpc2lvbiI6ICI0YzFkOWI3ZTJhMGY1ODM2ZDQxOWU3YzA1YjNhOGY2MWQyNzA0ZTkzIiwKICAgICJzb3VyY2VUcmVlRGlydHkiOiBmYWxzZSwKICAgICJzb3VyY2VSZXZpc2lvbiI6ICI5ZjBkM2ExYzRiNWU2ZjcwODE5MjBhM2I0YzVkNmU3ZjgwOTEwYTJiIiwKICAgICJweXRob25WZXJzaW9uIjogIjMuMTEuMTUiLAogICAgInBpeGlWZXJzaW9uIjogIjAuNzMuMCIsCiAgICAiZGVwZW5kZW5jeUxvY2tTaGEyNTYiOiAiM2IxZjhjNDdhMmQ5ZTA1YjZjNzQxOGFmMjNkNWU2OTAxN2I0YzhhZDkxZTJmMzUwNzY4YmQ0Y2ExOWUwZjViNyIsCiAgICAiYnVpbHRBdCI6ICIyMDI2LTA3LTI1VDEyOjAwOjAwKzAwOjAwIgogIH0KfQo=",
  "payloadSha256": "461c7f9f9bbcdff20ec102e6341768f0a637b60365ab2f64fda71576a950a353",
  "signatures": [
    {
      "algorithm": "ed25519",
      "keyId": "scrollcase-example-7a4a13db0c1a9432",
      "signatureBase64": "6VMYKUUJ+8dHuyfso0oCLtd1C+tZadHWaMM45Zzcf8o8SKfAlClSn9v0/y4hG+794o4zDpgyL994t5jvvyoBAQ=="
    }
  ]
}
